
SQL*Plus: Release 11.2.0.2.0 Production on Wed Aug 12 10:08:47 2026

Copyright (c) 1982, 2014, Oracle.  All rights reserved.

SQL> connect / as sysdba;
Connected.
SQL> create user qt236 identified by qt236;

User created.

SQL> connect qt236
Enter password:
ERROR:
ORA-01045: user QT236 lacks CREATE SESSION privilege; logon denied


Warning: You are no longer connected to ORACLE.
SQL> connect / as sysdba;
Connected.
SQL> grant all privileges to qt236;

Grant succeeded.

SQL> connect qt236
Enter password:
Connected.
SQL> show user;
USER is "QT236"
SQL> select * from tab;

no rows selected

SQL> connect / as sysdba;
Connected.
SQL> revoke all privileges from qt236;

Revoke succeeded.

SQL> connect qt236
Enter password:
ERROR:
ORA-01045: user QT236 lacks CREATE SESSION privilege; logon denied


Warning: You are no longer connected to ORACLE.
SQL>
===============================================================

SQL*Plus: Release 11.2.0.2.0 Production on Thu Aug 13 09:35:45 2026

Copyright (c) 1982, 2014, Oracle.  All rights reserved.

SQL> connect / as sysdba;
Connected.
SQL> drop user qt236;

User dropped.

SQL> create user qt236 identified by qt236;

User created.

SQL> connect qt236;
Enter password:
ERROR:
ORA-01045: user QT236 lacks CREATE SESSION privilege; logon denied


Warning: You are no longer connected to ORACLE.
SQL> grant all privileges to qt236;
SP2-0640: Not connected
SQL> connect / as sysdba;
Connected.
SQL> grant all privileges to qt236;

Grant succeeded.

SQL> connect qt236;
Enter password:
Connected.
SQL> connect / as sysdba;
Connected.
SQL> revoke all privileges from qt236;

Revoke succeeded.

SQL> connect qt236;
Enter password:
ERROR:
ORA-01045: user QT236 lacks CREATE SESSION privilege; logon denied


Warning: You are no longer connected to ORACLE.
SQL> connect / as sysdba;
Connected.
SQL> grant all privileges to qt236;

Grant succeeded.

SQL> connect qt236;
Enter password:
Connected.
SQL> select * from tab;

no rows selected

SQL> create table Sup(Sup_no varchar2(2),Sup_Name varchar2(10),Item_Supplied number(10),Item_Price number(2));

Table created.


SQL> select * from tab;

TNAME                          TABTYPE  CLUSTERID
------------------------------ ------- ----------
SUP                            TABLE

SQL> desc sup;
 Name                                      Null?    Type
 ----------------------------------------- -------- ----------------------------
 SUP_NO                                             VARCHAR2(2)
 SUP_NAME                                           VARCHAR2(10)
 ITEM_SUPPLIED                                      NUMBER(10)
 ITEM_PRICE                                         NUMBER(2)

SQL> select * from sup;

no rows selected

SQL> alter table sup add(City varchar2(15));

Table altered.

SQL> desc sup;
 Name                                      Null?    Type
 ----------------------------------------- -------- ----------------------------
 SUP_NO                                             VARCHAR2(2)
 SUP_NAME                                           VARCHAR2(10)
 ITEM_SUPPLIED                                      NUMBER(10)
 ITEM_PRICE                                         NUMBER(2)
 CITY                                               VARCHAR2(15)

SQL> alter table sup modify(iteam_supplied varchar2(12));
alter table sup modify(iteam_supplied varchar2(12))
                       *
ERROR at line 1:
ORA-00904: "ITEAM_SUPPLIED": invalid identifier


SQL> alter table sup modify(item_supplied varchar2(12));

Table altered.

SQL> desc sup;
 Name                                      Null?    Type
 ----------------------------------------- -------- ----------------------------
 SUP_NO                                             VARCHAR2(2)
 SUP_NAME                                           VARCHAR2(10)
 ITEM_SUPPLIED                                      VARCHAR2(12)
 ITEM_PRICE                                         NUMBER(2)
 CITY                                               VARCHAR2(15)

SQL> alter table sup modify(item_price number(4));

Table altered.

SQL> desc sup;
 Name                                      Null?    Type
 ----------------------------------------- -------- ----------------------------
 SUP_NO                                             VARCHAR2(2)
 SUP_NAME                                           VARCHAR2(10)
 ITEM_SUPPLIED                                      VARCHAR2(12)
 ITEM_PRICE                                         NUMBER(4)
 CITY                                               VARCHAR2(15)

SQL> alter table sup add(fefjew varchar2(15));

Table altered.

SQL> desc sup;
 Name                                      Null?    Type
 ----------------------------------------- -------- ----------------------------
 SUP_NO                                             VARCHAR2(2)
 SUP_NAME                                           VARCHAR2(10)
 ITEM_SUPPLIED                                      VARCHAR2(12)
 ITEM_PRICE                                         NUMBER(4)
 CITY                                               VARCHAR2(15)
 FEFJEW                                             VARCHAR2(15)

SQL> alter table sup rename column fefjew to product;

Table altered.

SQL> desc sup;
 Name                                      Null?    Type
 ----------------------------------------- -------- ----------------------------
 SUP_NO                                             VARCHAR2(2)
 SUP_NAME                                           VARCHAR2(10)
 ITEM_SUPPLIED                                      VARCHAR2(12)
 ITEM_PRICE                                         NUMBER(4)
 CITY                                               VARCHAR2(15)
 PRODUCT                                            VARCHAR2(15)

SQL> alter table sup drop column product;

Table altered.

SQL> desc sup;
 Name                                      Null?    Type
 ----------------------------------------- -------- ----------------------------
 SUP_NO                                             VARCHAR2(2)
 SUP_NAME                                           VARCHAR2(10)
 ITEM_SUPPLIED                                      VARCHAR2(12)
 ITEM_PRICE                                         NUMBER(4)
 CITY                                               VARCHAR2(15)

SQL> rename table sup to Supplier;
rename table sup to Supplier
       *
ERROR at line 1:
ORA-00903: invalid table name


SQL> rename sup to Supplier;

Table renamed.

SQL> desc sup;
ERROR:
ORA-04043: object sup does not exist


SQL> desc suppliER;
 Name                                      Null?    Type
 ----------------------------------------- -------- ----------------------------
 SUP_NO                                             VARCHAR2(2)
 SUP_NAME                                           VARCHAR2(10)
 ITEM_SUPPLIED                                      VARCHAR2(12)
 ITEM_PRICE                                         NUMBER(4)
 CITY                                               VARCHAR2(15)

SQL>
=================================

SQL> connect qt236
Enter password:
Connected.
SQL> select * from tab;

TNAME                          TABTYPE  CLUSTERID
------------------------------ ------- ----------
SUPPLIER                       TABLE

SQL> select * from supplier;

no rows selected

SQL> desc supplier;
 Name                                      Null?    Type
 ----------------------------------------- -------- ----------------------------
 SUP_NO                                             VARCHAR2(2)
 SUP_NAME                                           VARCHAR2(10)
 ITEM_SUPPLIED                                      VARCHAR2(12)
 ITEM_PRICE                                         NUMBER(4)
 CITY                                               VARCHAR2(15)

SQL> insert into supplier values('S1','Suresh','Keyboard',400,'Hyderabad');

1 row created.

SQL> select * from supplier;

SU SUP_NAME   ITEM_SUPPLIE ITEM_PRICE CITY
-- ---------- ------------ ---------- ---------------
S1 Suresh     Keyboard            400 Hyderabad

SQL> select * from student;
select * from student
              *
ERROR at line 1:
ORA-00942: table or view does not exist


SQL> insert into supplier values('S2,'Kiran','Processor',8000,'Delhi');
ERROR:
ORA-01756: quoted string not properly terminated


SQL> insert into supplier values('S2','Kiran','Processor',8000,'Delhi');

1 row created.

SQL> select * from supplier;

SU SUP_NAME   ITEM_SUPPLIE ITEM_PRICE CITY
-- ---------- ------------ ---------- ---------------
S1 Suresh     Keyboard            400 Hyderabad
S2 Kiran      Processor          8000 Delhi

SQL> select sup_no,sup_name,ITEM_PRICE from supplier;

SU SUP_NAME   ITEM_PRICE
-- ---------- ----------
S1 Suresh            400
S2 Kiran            8000

SQL> insert into supplier values('S3','Mohan',350);
insert into supplier values('S3','Mohan',350)
            *
ERROR at line 1:
ORA-00947: not enough values


SQL> insert into supplier(sup_no,sup_name,item_price) values('S3','Mohan',350);

1 row created.

SQL> select * from supplier;

SU SUP_NAME   ITEM_SUPPLIE ITEM_PRICE CITY
-- ---------- ------------ ---------- ---------------
S1 Suresh     Keyboard            400 Hyderabad
S2 Kiran      Processor          8000 Delhi
S3 Mohan                          350

SQL>
==================================

SQL*Plus: Release 11.2.0.2.0 Production on Mon Aug 17 09:40:21 2026

Copyright (c) 1982, 2014, Oracle.  All rights reserved.

SQL> connect db236
Enter password:
ERROR:
ORA-01017: invalid username/password; logon denied


SQL> connect qt236
Enter password:
Connected.
SQL> select * from tab;

TNAME                          TABTYPE  CLUSTERID
------------------------------ ------- ----------
SUPPLIER                       TABLE

SQL> desc supplier;
 Name                                      Null?    Type
 ----------------------------------------- -------- ----------------------------
 SUP_NO                                             VARCHAR2(2)
 SUP_NAME                                           VARCHAR2(10)
 ITEM_SUPPLIED                                      VARCHAR2(12)
 ITEM_PRICE                                         NUMBER(4)
 CITY                                               VARCHAR2(15)

SQL> select * from supplier;

SU SUP_NAME   ITEM_SUPPLIE ITEM_PRICE CITY
-- ---------- ------------ ---------- ---------------
S1 Suresh     Keyboard            400 Hyderabad
S2 Kiran      Processor          8000 Delhi
S3 Mohan                          350

SQL> insert into supplier values('S4','Ramesh','Bangalore');
insert into supplier values('S4','Ramesh','Bangalore')
            *
ERROR at line 1:
ORA-00947: not enough values


SQL> insert into supplier(sup_no,sup_name,city) values('S4','Ramesh','Bangalore');

1 row created.

SQL> select * from supplier;

SU SUP_NAME   ITEM_SUPPLIE ITEM_PRICE CITY
-- ---------- ------------ ---------- ---------------
S1 Suresh     Keyboard            400 Hyderabad
S2 Kiran      Processor          8000 Delhi
S3 Mohan                          350
S4 Ramesh                             Bangalore

SQL> insert into supplier values('&sup_no','&sup_name','&ITEM_SUPPLIED',&ITEM_PRICE,'&city');
Enter value for sup_no: 'S5'
Enter value for sup_name: 'Manish'
Enter value for item_supplied: 'Printer'
Enter value for item_price: 6000
Enter value for city: 'Mumbai'
old   1: insert into supplier values('&sup_no','&sup_name','&ITEM_SUPPLIED',&ITEM_PRICE,'&city')
new   1: insert into supplier values(''S5'',''Manish'',''Printer'',6000,''Mumbai'')
insert into supplier values(''S5'',''Manish'',''Printer'',6000,''Mumbai'')
                              *
ERROR at line 1:
ORA-00917: missing comma


SQL> insert into supplier values('&sup_no','&sup_name','&ITEM_SUPPLIED',&ITEM_PRICE,'&city');
Enter value for sup_no: 'S5'
Enter value for sup_name: 'Manish'
Enter value for item_supplied: 'Printer'
Enter value for item_price: 6000
Enter value for city: 'Mumbai'
old   1: insert into supplier values('&sup_no','&sup_name','&ITEM_SUPPLIED',&ITEM_PRICE,'&city')
new   1: insert into supplier values(''S5'',''Manish'',''Printer'',6000,''Mumbai'')
insert into supplier values(''S5'',''Manish'',''Printer'',6000,''Mumbai'')
                              *
ERROR at line 1:
ORA-00917: missing comma


SQL> insert into supplier values('&sup_no','&sup_name','&ITEM_SUPPLIED',&ITEM_PRICE,'&city');
Enter value for sup_no: 'S5'
Enter value for sup_name: 'Manish'
Enter value for item_supplied: 'Printer'
Enter value for item_price: 6000
Enter value for city: 'Mumbai'
old   1: insert into supplier values('&sup_no','&sup_name','&ITEM_SUPPLIED',&ITEM_PRICE,'&city')
new   1: insert into supplier values(''S5'',''Manish'',''Printer'',6000,''Mumbai'')
insert into supplier values(''S5'',''Manish'',''Printer'',6000,''Mumbai'')
                              *
ERROR at line 1:
ORA-00917: missing comma


SQL> insert into supplier values('&sup_no','&sup_name','&ITEM_SUPPLIED',&ITEM_PRICE,'&city');
Enter value for sup_no: 'S5'
Enter value for sup_name: 'Manish'
Enter value for item_supplied: 'Printer'
Enter value for item_price: 6000
Enter value for city: 'Mumbai'
old   1: insert into supplier values('&sup_no','&sup_name','&ITEM_SUPPLIED',&ITEM_PRICE,'&city')
new   1: insert into supplier values(''S5'',''Manish'',''Printer'',6000,''Mumbai'')
insert into supplier values(''S5'',''Manish'',''Printer'',6000,''Mumbai'')
                              *
ERROR at line 1:
ORA-00917: missing comma


SQL> insert into supplier values('&sup_no','&sup_name','&ITEM_SUPPLIED',&ITEM_PRICE,'&city');
Enter value for sup_no: S5
Enter value for sup_name: Manish
Enter value for item_supplied: Printer
Enter value for item_price: 6000
Enter value for city: Mumbai
old   1: insert into supplier values('&sup_no','&sup_name','&ITEM_SUPPLIED',&ITEM_PRICE,'&city')
new   1: insert into supplier values('S5','Manish','Printer',6000,'Mumbai')

1 row created.

SQL> /
Enter value for sup_no: S6
Enter value for sup_name: Srikanth
Enter value for item_supplied: Processor
Enter value for item_price: 8500
Enter value for city: Chennai
old   1: insert into supplier values('&sup_no','&sup_name','&ITEM_SUPPLIED',&ITEM_PRICE,'&city')
new   1: insert into supplier values('S6','Srikanth','Processor',8500,'Chennai')

1 row created.

SQL> select * from supplier;

SU SUP_NAME   ITEM_SUPPLIE ITEM_PRICE CITY
-- ---------- ------------ ---------- ---------------
S1 Suresh     Keyboard            400 Hyderabad
S2 Kiran      Processor          8000 Delhi
S3 Mohan                          350
S4 Ramesh                             Bangalore
S5 Manish     Printer            6000 Mumbai
S6 Srikanth   Processor          8500 Chennai

6 rows selected.

SQL> insert into supplier values('&&sup_no','&&sup_name','&&ITEM_SUPPLIED',&&ITEM_PRICE,'&&city');
Enter value for sup_no: S7
Enter value for sup_name: krishna
Enter value for item_supplied: Laptop
Enter value for item_price: 8888
Enter value for city: Hyd
old   1: insert into supplier values('&&sup_no','&&sup_name','&&ITEM_SUPPLIED',&&ITEM_PRICE,'&&city')
new   1: insert into supplier values('S7','krishna','Laptop',8888,'Hyd')

1 row created.

SQL> //
old   1: insert into supplier values('&&sup_no','&&sup_name','&&ITEM_SUPPLIED',&&ITEM_PRICE,'&&city')
new   1: insert into supplier values('S7','krishna','Laptop',8888,'Hyd')

1 row created.

SQL> //
old   1: insert into supplier values('&&sup_no','&&sup_name','&&ITEM_SUPPLIED',&&ITEM_PRICE,'&&city')
new   1: insert into supplier values('S7','krishna','Laptop',8888,'Hyd')

1 row created.

SQL> //
old   1: insert into supplier values('&&sup_no','&&sup_name','&&ITEM_SUPPLIED',&&ITEM_PRICE,'&&city')
new   1: insert into supplier values('S7','krishna','Laptop',8888,'Hyd')

1 row created.

SQL> //
old   1: insert into supplier values('&&sup_no','&&sup_name','&&ITEM_SUPPLIED',&&ITEM_PRICE,'&&city')
new   1: insert into supplier values('S7','krishna','Laptop',8888,'Hyd')

1 row created.

SQL> select * from supplier;

SU SUP_NAME   ITEM_SUPPLIE ITEM_PRICE CITY
-- ---------- ------------ ---------- ---------------
S1 Suresh     Keyboard            400 Hyderabad
S2 Kiran      Processor          8000 Delhi
S3 Mohan                          350
S4 Ramesh                             Bangalore
S5 Manish     Printer            6000 Mumbai
S6 Srikanth   Processor          8500 Chennai
S7 krishna    Laptop             8888 Hyd
S7 krishna    Laptop             8888 Hyd
S7 krishna    Laptop             8888 Hyd
S7 krishna    Laptop             8888 Hyd
S7 krishna    Laptop             8888 Hyd

11 rows selected.

SQL>
SQL> commit;

Commit complete.

SQL> update supplier set ITEM_SUPPLIED='Mouse';

11 rows updated.

SQL> select * from supplier;

SU SUP_NAME   ITEM_SUPPLIE ITEM_PRICE CITY
-- ---------- ------------ ---------- ---------------
S1 Suresh     Mouse               400 Hyderabad
S2 Kiran      Mouse              8000 Delhi
S3 Mohan      Mouse               350
S4 Ramesh     Mouse                   Bangalore
S5 Manish     Mouse              6000 Mumbai
S6 Srikanth   Mouse              8500 Chennai
S7 krishna    Mouse              8888 Hyd
S7 krishna    Mouse              8888 Hyd
S7 krishna    Mouse              8888 Hyd
S7 krishna    Mouse              8888 Hyd
S7 krishna    Mouse              8888 Hyd

11 rows selected.

SQL> rollback;

Rollback complete.

SQL> select * from supplier;

SU SUP_NAME   ITEM_SUPPLIE ITEM_PRICE CITY
-- ---------- ------------ ---------- ---------------
S1 Suresh     Keyboard            400 Hyderabad
S2 Kiran      Processor          8000 Delhi
S3 Mohan                          350
S4 Ramesh                             Bangalore
S5 Manish     Printer            6000 Mumbai
S6 Srikanth   Processor          8500 Chennai
S7 krishna    Laptop             8888 Hyd
S7 krishna    Laptop             8888 Hyd
S7 krishna    Laptop             8888 Hyd
S7 krishna    Laptop             8888 Hyd
S7 krishna    Laptop             8888 Hyd

11 rows selected.

 QL> update supplier set ITEM_SUPPLIED='Mouse' where sup_no='S3';

1 row updated.

SQL> select * from supplier;

SU SUP_NAME   ITEM_SUPPLIE ITEM_PRICE CITY
-- ---------- ------------ ---------- ---------------
S1 Suresh     Keyboard            400 Hyderabad
S2 Kiran      Processor          8000 Delhi
S3 Mohan      Mouse               350
S4 Ramesh                             Bangalore
S5 Manish     Printer            6000 Mumbai
S6 Srikanth   Processor          8500 Chennai
S7 krishna    Laptop             8888 Hyd
S7 krishna    Laptop             8888 Hyd
S7 krishna    Laptop             8888 Hyd
S7 krishna    Laptop             8888 Hyd
S7 krishna    Laptop             8888 Hyd

11 rows selected.

SQL> update supplier set city='Delhi' where sup_no='S3';

1 row updated.

SQL> select * from supplier;

SU SUP_NAME   ITEM_SUPPLIE ITEM_PRICE CITY
-- ---------- ------------ ---------- ---------------
S1 Suresh     Keyboard            400 Hyderabad
S2 Kiran      Processor          8000 Delhi
S3 Mohan      Mouse               350 Delhi
S4 Ramesh                             Bangalore
S5 Manish     Printer            6000 Mumbai
S6 Srikanth   Processor          8500 Chennai
S7 krishna    Laptop             8888 Hyd
S7 krishna    Laptop             8888 Hyd
S7 krishna    Laptop             8888 Hyd
S7 krishna    Laptop             8888 Hyd
S7 krishna    Laptop             8888 Hyd

11 rows selected.

SQL> update supplier set ITEM_SUPPLIED='Processor' and ITEM_PRICE=9000 where sup_no='S4';
update supplier set ITEM_SUPPLIED='Processor' and ITEM_PRICE=9000 where sup_no='S4'
                                              *
ERROR at line 1:
ORA-00933: SQL command not properly ended


SQL> update supplier set ITEM_SUPPLIED='Processor' && ITEM_PRICE=9000 where sup_no='S4';
old   1: update supplier set ITEM_SUPPLIED='Processor' && ITEM_PRICE=9000 where sup_no='S4'
new   1: update supplier set ITEM_SUPPLIED='Processor' 8888=9000 where sup_no='S4'
update supplier set ITEM_SUPPLIED='Processor' 8888=9000 where sup_no='S4'
                                              *
ERROR at line 1:
ORA-00933: SQL command not properly ended


SQL> update supplier set ITEM_SUPPLIED='Processor' and ITEM_PRICE=9000 where sup_no='S4';
update supplier set ITEM_SUPPLIED='Processor' and ITEM_PRICE=9000 where sup_no='S4'
                                              *
ERROR at line 1:
ORA-00933: SQL command not properly ended


SQL> update supplier set ITEM_SUPPLIED='Processor',ITEM_PRICE=9000 where sup_no='S4';

1 row updated.

SQL> select * from supplier;

SU SUP_NAME   ITEM_SUPPLIE ITEM_PRICE CITY
-- ---------- ------------ ---------- ---------------
S1 Suresh     Keyboard            400 Hyderabad
S2 Kiran      Processor          8000 Delhi
S3 Mohan      Mouse               350 Delhi
S4 Ramesh     Processor          9000 Bangalore
S5 Manish     Printer            6000 Mumbai
S6 Srikanth   Processor          8500 Chennai
S7 krishna    Laptop             8888 Hyd
S7 krishna    Laptop             8888 Hyd
S7 krishna    Laptop             8888 Hyd
S7 krishna    Laptop             8888 Hyd
S7 krishna    Laptop             8888 Hyd

11 rows selected.

SQL> select * from supplier where ITEM_PRICE>=5000;

SU SUP_NAME   ITEM_SUPPLIE ITEM_PRICE CITY
-- ---------- ------------ ---------- ---------------
S2 Kiran      Processor          8000 Delhi
S4 Ramesh     Processor          9000 Bangalore
S5 Manish     Printer            6000 Mumbai
S6 Srikanth   Processor          8500 Chennai
S7 krishna    Laptop             8888 Hyd
S7 krishna    Laptop             8888 Hyd
S7 krishna    Laptop             8888 Hyd
S7 krishna    Laptop             8888 Hyd
S7 krishna    Laptop             8888 Hyd

9 rows selected.

SQL> select * from supplier where ITEM_PRICE>=5000 and ITEM_SUPPLIED='Processor';

SU SUP_NAME   ITEM_SUPPLIE ITEM_PRICE CITY
-- ---------- ------------ ---------- ---------------
S2 Kiran      Processor          8000 Delhi
S4 Ramesh     Processor          9000 Bangalore
S6 Srikanth   Processor          8500 Chennai

SQL> select sup_no,sup_name,city from supplier where ITEM_PRICE>=5000 and ITEM_SUPPLIED='Processor';

SU SUP_NAME   CITY
-- ---------- ---------------
S2 Kiran      Delhi
S4 Ramesh     Bangalore
S6 Srikanth   Chennai

SQL>
SQL> commit;

Commit complete.

SQL> delete supplier;

11 rows deleted.

SQL> select * from supplier;

no rows selected

SQL> rollback;

Rollback complete.

SQL>
SQL> select * from supplier;

SU SUP_NAME   ITEM_SUPPLIE ITEM_PRICE CITY
-- ---------- ------------ ---------- ---------------
S1 Suresh     Keyboard            400 Hyderabad
S2 Kiran      Processor          8000 Delhi
S3 Mohan      Mouse               350 Delhi
S4 Ramesh     Processor          9000 Bangalore
S5 Manish     Printer            6000 Mumbai
S6 Srikanth   Processor          8500 Chennai
S7 krishna    Laptop             8888 Hyd
S7 krishna    Laptop             8888 Hyd
S7 krishna    Laptop             8888 Hyd
S7 krishna    Laptop             8888 Hyd
S7 krishna    Laptop             8888 Hyd

11 rows selected.

SQL> delete supplier where sup_no='S7';

5 rows deleted.

SQL> select * from supplier;

SU SUP_NAME   ITEM_SUPPLIE ITEM_PRICE CITY
-- ---------- ------------ ---------- ---------------
S1 Suresh     Keyboard            400 Hyderabad
S2 Kiran      Processor          8000 Delhi
S3 Mohan      Mouse               350 Delhi
S4 Ramesh     Processor          9000 Bangalore
S5 Manish     Printer            6000 Mumbai
S6 Srikanth   Processor          8500 Chennai

6 rows selected.

SQL> delete supplier where sup_no='S7';

0 rows deleted.

SQL> select * from supplier;

SU SUP_NAME   ITEM_SUPPLIE ITEM_PRICE CITY
-- ---------- ------------ ---------- ---------------
S1 Suresh     Keyboard            400 Hyderabad
S2 Kiran      Processor          8000 Delhi
S3 Mohan      Mouse               350 Delhi
S4 Ramesh     Processor          9000 Bangalore
S5 Manish     Printer            6000 Mumbai
S6 Srikanth   Processor          8500 Chennai

6 rows selected.

SQL> commit;

Commit complete.

SQL>
==============================

SQL*Plus: Release 11.2.0.2.0 Production on Tue Aug 18 10:04:57 2026

Copyright (c) 1982, 2014, Oracle.  All rights reserved.

SQL> connect qt236
Enter password:
Connected.
SQL> create table stu1(htno number(3),sname varchar2(20),dob date,gender char(1),sub1 number(3),sub2 number(3),sub3 number(3),average number(5,2));

Table created.

SQL> desc stu1;
 Name                                      Null?    Type
 ----------------------------------------- -------- ----------------------------
 HTNO                                               NUMBER(3)
 SNAME                                              VARCHAR2(20)
 DOB                                                DATE
 GENDER                                             CHAR(1)
 SUB1                                               NUMBER(3)
 SUB2                                               NUMBER(3)
 SUB3                                               NUMBER(3)
 AVERAGE                                            NUMBER(5,2)

SQL> alter table drop column average;
alter table drop column average
            *
ERROR at line 1:
ORA-00903: invalid table name


SQL> alter table stu1 drop column average;

Table altered.

SQL> desc stu1;
 Name                                      Null?    Type
 ----------------------------------------- -------- ----------------------------
 HTNO                                               NUMBER(3)
 SNAME                                              VARCHAR2(20)
 DOB                                                DATE
 GENDER                                             CHAR(1)
 SUB1                                               NUMBER(3)
 SUB2                                               NUMBER(3)
 SUB3                                               NUMBER(3)

SQL> insert into stu1 values(101,'Krishna','10/feb/99','M',99,88,77);

1 row created.

SQL> select * from stu1;

      HTNO SNAME                DOB       G       SUB1       SUB2 SUB3
---------- -------------------- --------- - ---------- ---------- ----------
       101 Krishna              10-FEB-99 M         99         88   77

SQL> insert into stu1 values('102','Krishna','10/feb/99','M',99,88,77);

1 row created.

SQL> insert into stu1 values('hgt','Krishna','10/feb/99','M',99,88,77);
insert into stu1 values('hgt','Krishna','10/feb/99','M',99,88,77)
                        *
ERROR at line 1:
ORA-01722: invalid number


SQL> insert into stu1 values(103,'fehf$%$%534DGDFG','22/march/1997','Male',99,88,77);
insert into stu1 values(103,'fehf$%$%534DGDFG','22/march/1997','Male',99,88,77)
                                                               *
ERROR at line 1:
ORA-12899: value too large for column "QT236"."STU1"."GENDER" (actual: 4,
maximum: 1)


SQL> insert into stu1 values(103,'fehf$%$%534DGDFG','22/march/1997','M',99,89,79);

1 row created.

SQL> select * from stu1;

      HTNO SNAME                DOB       G       SUB1       SUB2    SUB3
---------- -------------------- --------- - ---------- ---------- ----------
       101 Krishna              10-FEB-99 M         99         88      77
       102 Krishna              10-FEB-99 M         99         88      77
       103 fehf$%$%534DGDFG     22-MAR-97 M         99         89      79

SQL> insert into stu1 values(103,'fehf$%$%534DGDFG','22/ramesh/1997','Male',99,88,77);
insert into stu1 values(103,'fehf$%$%534DGDFG','22/ramesh/1997','Male',99,88,77)
                                               *
ERROR at line 1:
ORA-01843: not a valid month


SQL> insert into stu1 values(104,'12345','22/december/1997','Male',99,88,77);
insert into stu1 values(104,'12345','22/december/1997','Male',99,88,77)
                                                       *
ERROR at line 1:
ORA-12899: value too large for column "QT236"."STU1"."GENDER" (actual: 4,
maximum: 1)


SQL> insert into stu1 values(104,'12345','22/december/1997','M',99,88,77);

1 row created.

SQL> select * from stu1;

      HTNO SNAME                DOB       G       SUB1       SUB2    SUB3
---------- -------------------- --------- - ---------- ---------- ----------
       101 Krishna              10-FEB-99 M         99         88      77
       102 Krishna              10-FEB-99 M         99         88      77
       103 fehf$%$%534DGDFG     22-MAR-97 M         99         89      79
       104 12345                22-DEC-97 M         99         88      77

SQL> create table test1(sid number(3),percentage number(5,2));

Table created.

SQL> insert into test1 values(111,999.99);

1 row created.

SQL> select * from test1;

       SID PERCENTAGE
---------- ----------
       111     999.99

SQL> insert into test1 values(111,999.999);
insert into test1 values(111,999.999)
                             *
ERROR at line 1:
ORA-01438: value larger than specified precision allowed for this column


SQL> insert into test1 values(111,99.999);

1 row created.

SQL> select * from test1;

       SID PERCENTAGE
---------- ----------
       111     999.99
       111        100

SQL> insert into test1 values(112,9999.99);
insert into test1 values(112,9999.99)
                             *
ERROR at line 1:
ORA-01438: value larger than specified precision allowed for this column


SQL> insert into test1 values(112,999.999);
insert into test1 values(112,999.999)
                             *
ERROR at line 1:
ORA-01438: value larger than specified precision allowed for this column


SQL> insert into test1 values(112,9999.99);
insert into test1 values(112,9999.99)
                             *
ERROR at line 1:
ORA-01438: value larger than specified precision allowed for this column


SQL> insert into test1 values(112,99.9);

1 row created.

SQL> insert into test1(sid) values(115);

1 row created.

SQL> select * from test1;

       SID PERCENTAGE
---------- ----------
       111     999.99
       111        100
       112       99.9
       115

SQL> create table stu2(sid number(3) primary key,sname varchar2(20) not null,mobile number(5) unique),marks number(3));
create table stu2(sid number(3) primary key,sname varchar2(20) not null,mobile number(5) unique),marks number(3))
                                                                                                *
ERROR at line 1:
ORA-00922: missing or invalid option


SQL> create table stu2(sid number(3) primary key,sname varchar2(20) not null,mobile number(5) unique,marks number(3));

Table created.

SQL> desc stu2;
 Name                                      Null?    Type
 ----------------------------------------- -------- ----------------------------
 SID                                       NOT NULL NUMBER(3)
 SNAME                                     NOT NULL VARCHAR2(20)
 MOBILE                                             NUMBER(5)
 MARKS                                              NUMBER(3)

SQL> insert into stu2 values(101,'Krishna',12345,99);

1 row created.

SQL> select * from stu2;

       SID SNAME                    MOBILE      MARKS
---------- -------------------- ---------- ----------
       101 Krishna                   12345         99

SQL> insert into stu2 values(101,'Krishna',12345,99);
insert into stu2 values(101,'Krishna',12345,99)
*
ERROR at line 1:
ORA-00001: unique constraint (QT236.SYS_C007077) violated


SQL> insert into stu2 values(101,'Ramesh',12345,99);
insert into stu2 values(101,'Ramesh',12345,99)
*
ERROR at line 1:
ORA-00001: unique constraint (QT236.SYS_C007077) violated


SQL> insert into stu2 values(102,'Ramesh',12345,99);
insert into stu2 values(102,'Ramesh',12345,99)
*
ERROR at line 1:
ORA-00001: unique constraint (QT236.SYS_C007078) violated


SQL> insert into stu2 values(102,'Ramesh',12346,99);

1 row created.

SQL> select * from stu2;

       SID SNAME                    MOBILE      MARKS
---------- -------------------- ---------- ----------
       101 Krishna                   12345         99
       102 Ramesh                    12346         99

SQL> insert into stu2 values(103,'Ramesh',12345,98);
insert into stu2 values(103,'Ramesh',12345,98)
*
ERROR at line 1:
ORA-00001: unique constraint (QT236.SYS_C007078) violated


SQL> insert into stu2(sname,mobile,marks) values('Ramesh',12365,98);
insert into stu2(sname,mobile,marks) values('Ramesh',12365,98)
*
ERROR at line 1:
ORA-01400: cannot insert NULL into ("QT236"."STU2"."SID")


SQL> insert into stu2(sid,sname,marks) values(106,'Ramesh',98);

1 row created.

SQL> select * from stu2;

       SID SNAME                    MOBILE      MARKS
---------- -------------------- ---------- ----------
       101 Krishna                   12345         99
       102 Ramesh                    12346         99
       106 Ramesh                                  98

SQL> insert into stu2(sid,mobile,marks) values(106,1111,98);
insert into stu2(sid,mobile,marks) values(106,1111,98)
*
ERROR at line 1:
ORA-01400: cannot insert NULL into ("QT236"."STU2"."SNAME")


SQL>
=========================

SQL*Plus: Release 11.2.0.2.0 Production on Wed Aug 19 09:43:05 2026

Copyright (c) 1982, 2014, Oracle.  All rights reserved.

SQL> connect qt236
Enter password:
Connected.
SQL> desc test2;
 Name                                      Null?    Type
 ----------------------------------------- -------- ----------------------------
 ID                                             NUMBER(30)
 DOJ                                            TIMESTAMP(6)

SQL> select * from test2;

no rows selected

SQL> select * from test2;

        ID
----------
DOJ
---------------------------------------------------------------------------
        11
19-AUG-26 09.48.22.000000 AM


SQL> select * from test2;

        ID
----------
DOJ
---------------------------------------------------------------------------
        11
19-AUG-26 09.48.22.000000 AM


SQL> select * from test2;

        ID
----------
DOJ
---------------------------------------------------------------------------
        11
19-AUG-26 09.48.22.000000 AM

        12
18-AUG-26 09.58.22.000000 AM


SQL> commit;

Commit complete.

SQL> set linesize 200;
SQL> select * from test2;

        ID DOJ
---------- ---------------------------------------------------------------------------
        11 19-AUG-26 09.48.22.000000 AM
        12 18-AUG-26 09.58.22.000000 AM

SQL> commit;

Commit complete.

SQL> rollback;

Rollback complete.

SQL> select * from test2;

        ID DOJ
---------- ---------------------------------------------------------------------------
        11 19-AUG-26 09.48.22.000000 AM
        12 18-AUG-26 09.58.22.000000 AM

SQL> insert into test2 values(13,'17-AUG-26 09.58.22.000000 AM')
  2  ;

1 row created.

SQL> select * from test2;

        ID DOJ
---------- ---------------------------------------------------------------------------
        11 19-AUG-26 09.48.22.000000 AM
        12 18-AUG-26 09.58.22.000000 AM
        13 17-AUG-26 09.58.22.000000 AM

SQL> rollback;

Rollback complete.

SQL> select * from test2;

        ID DOJ
---------- ---------------------------------------------------------------------------
        11 19-AUG-26 09.48.22.000000 AM
        12 18-AUG-26 09.58.22.000000 AM

SQL> insert into test2 values(13,'17-AUG-26 09.58.22.000000 AM')
  2  ;

1 row created.

SQL> select * from test2;

        ID DOJ
---------- ---------------------------------------------------------------------------
        11 19-AUG-26 09.48.22.000000 AM
        12 18-AUG-26 09.58.22.000000 AM
        13 17-AUG-26 09.58.22.000000 AM

SQL> commit;

Commit complete.

SQL> rollback;

Rollback complete.

SQL> select * from test2;

        ID DOJ
---------- ---------------------------------------------------------------------------
        11 19-AUG-26 09.48.22.000000 AM
        12 18-AUG-26 09.58.22.000000 AM
        13 17-AUG-26 09.58.22.000000 AM

SQL> delete test2;

3 rows deleted.

SQL> select * from test2;

no rows selected

SQL> rollback;

Rollback complete.

SQL> select * from test2;

        ID DOJ
---------- ---------------------------------------------------------------------------
        11 19-AUG-26 09.48.22.000000 AM
        12 18-AUG-26 09.58.22.000000 AM
        13 17-AUG-26 09.58.22.000000 AM

SQL> delete test2 where id=13;

1 row deleted.

SQL> select * from test2;

        ID DOJ
---------- ---------------------------------------------------------------------------
        11 19-AUG-26 09.48.22.000000 AM
        12 18-AUG-26 09.58.22.000000 AM

SQL> commit;

Commit complete.

SQL> rollback;

Rollback complete.

SQL> select * from test2;

        ID DOJ
---------- ---------------------------------------------------------------------------
        11 19-AUG-26 09.48.22.000000 AM
        12 18-AUG-26 09.58.22.000000 AM

SQL>
